<?xml version = '1.0' encoding="UTF8"?> 
<!DOCTYPE arbre SYSTEM "arbre.dtd">

<arbre>
<branche id="b1" type="accueil" date="jj/mm/yyy">
	<question id="q1" texte="Que voyez vous ?" visible="true">
	<media>
		<legende>Vous devez nous dire ce que vous avez vue !!!</legende>
	</media>
		<reponse id="r1" texte="6 pattes" visible="true">
		<media>
			<img id="img1" src="toto6pattes.png" />
			<legende>c'est toto avec 6 pattes</legende>
		</media>
			<branche id="b2">
				<!-- ... -->
			</branche>
		</reponse>
		<reponse id="r2" texte="8 pattes, ailes et antennes absentes">
		  <branche id="b3" type="Arachnide">
			<question id="q2" texte="Quelle est la taille de l'arachnide ?">
				<reponse id="r3" texte="Supérieur à 5 mm" >
				  <resultat id="res1">
					<nom><!-- Nom de la morpho-espèce trouvée --></nom>
					<type>MEL1</type>
					<regimeAlimentaire>Prédateur</regimeAlimentaire>
					<informations><!-- Des informations complementaires sur la morpho-espèce --></informations>
					<media>
						<img id"img2" src="coucou.jpg" />
					</media>
				  </resultat>
				</reponse>
				<reponse id="r4" texte="Inférieur à 5 mm">
					<!-- ... -->
				</reponse>
			</question>
		  </branche>
		</reponse>
	</question>
</branche>
</arbre>