<?xml version = '1.0' encoding="UTF-8"?> 
<!DOCTYPE arbre SYSTEM "arbre.dtd">

<arbre>
	<branche id="b1" type="accueil" date="jj/mm/yyy">
		<question id="q1" texte="Quelle réponse décrit le mieux l'insecte que vous voyez ?" visible="true">
			<media>
				<legende>Astuces : Compter le nombre de pattes pour commencer</legende>
			</media>
			<reponse id="r1" texte="6 pattes" visible="true">
				<media>
					<img id="img1" src="6pattes1.jpg" />
					<img id="img1" src="6pattes2.jpg" />
					<legende>Exemple d'insecte à 6 pattes</legende>
				</media>
				<branche id="b2">
					<question id="q3" texte="Plus de question pour cet exemple test">
					</question>
				</branche>
			</reponse>
			<reponse id="r2" texte="8 pattes, ailes et antennes absentes">
			<media>
					<img id="img1" src="8pattes1.jpg" />
					<legende>Exemple d'insecte à 8 pattes</legende>
				</media>
			  <branche id="b3" type="Arachnide">
				<question id="q2" texte="Quelle est la taille de l'arachnide ?">
					<reponse id="r3" texte="Supérieur à 5 mm" >
					  <resultat id="res1">
						<nom>nom</nom>
						<type>MEL1</type>
						<regimeAlimentaire>Prédateur</regimeAlimentaire>
						<informations>infos</informations>
						<media>
							<img id="img2" src="image1.jpg" />
						</media>
					  </resultat>
					</reponse>
					<reponse id="r4" texte="Inférieur à 5 mm">
					</reponse>
				</question>
			  </branche>
			</reponse>
		</question>
	</branche>
</arbre>